Author,Article
Abigail Arunga,"I didn’t think it was entirely possible, but I did it anyway.
It’s so surprising how many things in our day-to-day life need Google to function. You don’t realise how many they are – until you have to do a whole day without them.
Think about it. When you wake up in the morning, you reach for your (probably) android phone. If you’re going to check out your route to work, you’re looking at it on Google Maps (have you checked out the new look Google Maps, by the way, in commemoration of their anniversary?). If you want to listen to some music during the day, you’ll likely listen to it on YouTube or Google Play – as you check your work email on – you guessed it – Gmail.
It was really hard for me to do an entire day without Google – and even in terms of commemoration, I failed at that a little bit too! I had to tweet about it, of course, because I am a millennial, and you know that with us, if there is no hashtag, it didn’t really happen (you can find the whole story on my Twitter. The hashtag I used was #ADayWithoutGoogle). So yes, I wrote about it. Writing about it, in fact, is what I did the whole day, because not being on Google makes work and life as a writer pretty impossible.
How can I not Google something about how to kill someone in the short story I am starting, or read the article about the Modern Love podcast on (ha!) Google Podcasts? As a creative – and maybe this differs across fields and careers – life without being able to fact check or double check is really, really hard. At some point, I just started to screenshot articles I was going to read on my Chrome browser on my phone, because apparently, as I quickly discovered, my laptop doesn’t seem to understand how to use Bing. Go figure.
It brings about a rather obvious question as we foray into the world of artificial intelligence and human dependence – which, as you can see, even if you look into your own life, is a prevalent trend. We already use computers and technology for so many things to make our lives easier – from apps like Calendar to plan and remind us about meetups to Assistant, for answering all the questions we’re too lazy to type, to following satellite-generated directions to places hours away that we’ve never been to. What does this mean for the human race? In the event of a Wall-E like apocalypse, would we even survive?"
Abigail Arunga,"I have a new favourite cute little café. It’s called the Pallet Café, and it is on James Gichuru Road. My favourite thing about it is that it is disability friendly – and by that I mean, all the servers are deaf.
There’s something distinctly beautiful about empathy, and people who try and make others aware that there are more people that don’t look like them in the world.
It’s a factor of privilege, I suppose – you grow up a certain way, around the same people, and you start assuming that everyone looks just like you and is just like you. That is quite obviously not always the case. When you walk into Pallet, you will notice a stand on the side that indicates the sign language alphabet. This will be handy for you while ordering, even though you can do the boring thing and point at the menu – which is also fine."
Abigail Arunga,"After Always had a terrible experience with Kenyan women, they decided to roll out a new brand of pads that encapsulate an improvement on the previous ones they were flooding the Kenyan market with.
Granted, not everyone uses Always (although, statistically, most people who use pads in this country start with Always). And again, not everyone who uses Always suffers in the same way the people on the Twitter streets were suffering.
But the ones who were suffering were very loud about it. There were complaints of rashes, weird overly perfumed odours and general irritation.
Always decided that the first best thing to do was to get influencers to back up their product – which, by the way, was a terrible idea. That’s mistake 101 – gas-lit advertising. Don’t try and make it sound like the people who are complaining have no idea of what they’re talking about, and are part of a select few who are just complainers by nature. Don’t get people with larger followings who are sticking to the script of a brief defend your brand. Who thought that failure up?
Then, their next grand master plan was to roll out this new product. As yet, I haven’t heard any rave reviews on the product yet, perhaps because the trust from the last public debacle is still lacking. Sanitary towels are actually a very sensitive subject to women – whether we are talking about the lack of towels, the offending taxes put on towels, the unavailability of towels (and tampons) or how bad the ones available are. Which is why it surprises me that Always brushed aside women’s concerns so quickly, and continue to do so.
Why do I say that they continue to do so? Because no one wants a new Always product – do they? I certainly don’t. I didn’t ask for a new repackaging or a whole different pad. No need to reinvent the wheel. All Kenyan women want is to be given sanitary products that match the quality of the ones that they are so willing to produce for first world countries. Surely we deserve at least that respect?
There are a number of reasons why they can say they are not doing this – perhaps it costs too much to manufacture. Or maybe distribution would be too complicated. But telling us this tripe that the quality is the same as it is abroad – when we have samples and testimonies to disprove this – is quite simply, taking us for fools.
Perhaps the global south is not much to the first world, but we can at least speak with our few shillings and not stand for this treatment. There are local brands that are readily available and willing to treat Kenyans like valued customers. Someone tell Always that almost doesn’t count. Someone tell Always that almost doesn’t count."
Abigail Arunga,"You probably know her on Instagram as @hujabi_villain, but her name is Faiza Hemed.
Faiza is a former accountant-turned digital media specialist and content creator whose experience involves writing, producing and hosting entertainment video content. Here is her story:
1. Why does the nature of online comedy appeal to you, and when did you venture into it?
I've always been on the pursuit of a good laugh. I believe you can get through anything in life with a sense of humour.
After quitting my accounting job, I landed a job at a digital media company about three years back and that's when my colleague Cherie Lindiwe discovered she could make something out of the laughs we had in the office daily.
However, I wouldn't classify what I do online as comedy — it's more of satire because at the end of the day, there's a lesson to be learnt from the content I produce."
Abigail Arunga,"If you are anything like a typical Nairobian, you have no plans to do anything or go anywhere for Christmas Day. That is, if you haven’t been planning to go somewhere from the beginning of the year. If you're those planners, this isn’t for you.
This is for the people who are just as disorganised as me. The people who thought they didn’t want to do anything, but are now getting caught up in the drama and excitement of the holiday season.
Those people who thought they would be fine sitting at home, but are now looking longingly at pictures of people on Instagram. I can tell you how to make people look at your pictures longingly on Christmas or New Year’s Eve, too. Not that the point is social media – but green is a great colour on someone else, when it isn’t on you.
And I guarantee this method works! I would know, I tried it out last week, when I went to Radisson Blu in Upper Hill to sample a few of the delicacies they’re going to have on offer on New Year’s Eve.
So let me start with the price tag, which you’ll need to pay ASAP, seeing as the places are filling up fast (it’s Radisson. Of course spaces are filling up fast. Call 0791427917, like, yesterday)."
Abigail Arunga,"TI is coming to Kenya, and as is the case when a problematic man insists on coming to do a concert here, I am extremely conflicted.
On the one hand, it has always been clear to me that if R Kelly ever comes to Kenya, there would be no debate whatsoever about whether or not I would go to his concert. It is a no-brainer – in that I will not be going. Going for an R Kelly concert, for me, would be tantamount to agreeing with what he is doing, and has been doing, to underage girls, since he was in his 20s – assaulting them, using them, brainwashing them and raping them (which is what it is – it is statutory rape when someone the victim is underage). And in some cases, like Aaliyah’s, marrying them.
Of course, his perverted habits did not exist in a vacuum. There are equally horrible people who helped him to do these things – Aaliyah’s uncle, for example, who first introduced the pair to each other, regardless of the fact that he knew Kelly’s reputation.
To this day, her uncle, Barry Hankerson, has refused to release any of Aaliyah’s musical catalogue to the public, and therefore, the only music available to stream is her very first album – the Kelly-produced, incredibly gross wink to their ongoing relationship at the time, Age Ain’t Nothing But a Number. And then there’s that fact: that his music directly sings about what he was doing to this women. Kelly was leaving hints about his behaviour all over the place, unabashedly, unashamed. Chris Brown, for another example, came to Kenya, and I did go to the concert. I’m not sure what possessed me at the time, but I think I separated myself from his deeds by telling myself that he had done his time, for his misdeeds. And he was quite young at the time, and according to his documentary, he and Rihanna were violent towards each other (but no one boycotted Rihanna). And his jail time didn’t make a difference, because he continued to be violent to women and men alike after he was locked up.
So clearly the guy hasn’t changed. So why did I go for his concert, and how is he different? Both men have sustained violent histories. Both are extremely talented.
The same can be said of TI who is extremely talented and extremely problematic as well. I don’t know that I would want to give him my money. I feel like, before, his drama was bubbling under the surface, from songs like No Mediocre to touting Iggy Azalea as the forefront female rapper of his label, in spite of her nonsensical put on Southern accent and basically black-facing her music. He has since retracted these comments."
Abigail Arunga,"If there is any doubt that Kenyans are obsessed with wombs, policing women’s bodies and what people do in their bedrooms, that doubt has been completely eliminated by the International Conference on Population and Development (ICPD25). Kenyans are, indeed, obsessed.
The summit taking place in Nairobi marks 25 years since the first one where international bodies and governments agreed that access to proper sexual and reproductive healthcare information and services, as well as family planning services, are essential for women, and for development.
But with all the propaganda that is flying around, from a parallel conference by major churches, to social media, to videos by angry Caucasian pseudo-Christians, you would think that ICPD is trying to sanction nationwide orgies and scenes resembling the movie The Purge, where anarchy and murder reign. Perhaps it is the contrasting messaging. The fact that the government, and the president himself, allowed this conference to happen in Nairobi, would imply that he doesn’t actually have as big a problem with the conference as earlier indicated – contrary to statements he made last week. Then, the undue focus on pre and post natal care ignores everything else that the conference is addressing – like stopping FGM, for example, and ending maternal mortality – which, in spite of a dozen marathons or so, remains at an alarming statistic.
The facts: the government, by its own admission, owes the citizens of Kenya, basic healthcare, and sexual and reproductive health information and services. This does indeed involve talking about sex, its effects, and making sure that those who need hospitals can access them, for consultation and drugs if necessary. This is what Form Ni Gani was pushing for, this year and last year – the fact that the Constitution of Kenya 2010 guarantees the right to the highest standard reproductive health"" and the Health Act of 2017 guarantees safe, effective and affordable family planning for all Kenyan adults. Where is that safe, effective and affordable family planning, for all adults?"
Abigail Arunga,"It's the morning after. The birds are chirping. The sun has risen in its glory. Traffic has already begun to recover from the holiday to prepare for yet another holiday. The weekend is here. But once again, Ngugi Wa Thiong'o's much anticipated Nobel Prize for Literature, is not.
Ngugi is arguably the father of modern Kenyan literature and mother tongue psychology, and its impact on our cultures. He has been at the forefront, insisting that we write for ourselves, in our own languages, and has led the charge in this respect as well, literally putting his money and lifeblood where his mouth is. He is also an exiled hero, for dancing with these ideals, and a sorrowful but not complete returnee to the land whose leader rejected him, the land that insists he be awarded this prize (forget all the others) so they can acknowledge he whom we shunned. Year after year, we watch, irritated, as this legend is passed over, often for someone we deem unworthy or unknown. A country singer cum activist. A rapper who is said to be the reincarnation of Tupac. A...who?
The rage is fresh every year, but never unprecedented. It is an old and tiring wound that only flares up against the cold winds of arrogance. Surely, the world knows who Ngugi Wa Thiong'o is, and understands the place he holds in the hearts of every Kenyan schoolchild who either fell asleep to his rhetoric or greatly decided to be him? Surely they see that he deserves this? No, they don't, and they don't care. Unfortunately, we Africans are still addicted to validation outside of our own borders, which, funnily enough, does not sustain the lives and independences we are searching for. Because we have not decolonised our minds, as Ngugi has told us to do several times, we're still gutted when he is, once again, not mentioned as winner. We're gutted. Slighted. Angry. All valid feelings, but predominantly insignificant to the people who decide these sorts of things for us.
And that's where the problem lies. Someone is deciding this stuff for us. We're not doing it for ourselves, and we're clearly not done sycophantically pleading our case. A Nobel cannot and should not be the measure of what a good writer is, nor is it given to who is actually the best writer in the world, does it. If that were true, Ngugi would have stopped ages ago to become something safer with a better pension."
Abigail Arunga,"I think someone needs to look into the boredom levels of our MPs.
Something is clearly going on there, and I say this because of the recent dearth of bills they seem to be putting forward.
Dearth might be the wrong word – maybe the right word is, the lack of any sort of coherent thought process involved in what they are suggesting into law. The proposals before us are not only unimaginative and unnecessary in this clime, but also just…well, boring.
There was the appalling one from last week, about WhatsApp groups. Apparently the government wants to monitor all such groups in Kenya.
I won’t beat the dead horse again about how there are so many other things that our parliamentarians need to, and should, be focusing on – people dying, incoming famines, useless Huduma numbers, the whole lot. What I will focus on is the sheer impracticality of trying to monitor social media.
Social media is a monster of its own making, with or without the encrypting that WhatsApp offers. Because it is such a diverse offering, in that you have so many platforms – Facebook, Tinder, YouTube, Twitter, Snapchat, Instagram, TikTok, among so very many others – unless you’re the creator of such a platform, you really can’t regulate what goes on therein. And unless there is some international Cambridge Analytica-scale data breach going on that I don’t know about, I don’t know how the government will be able to regulate Kenya’s social media. And if there is a data breach – well, someone is getting sued."
Abigail Arunga,"There is a video of a child reacting to being bullied by his classmate that is doing rounds on social media. He calls the alleged bully all manner of names and uses Love and Hip Hop type phrases because this little girl called him gay.
I personally could not watch the video to the very end. Obviously it seemed contrived – this kid is using words he sees on television, and introductions from a classic YouTube channel to put his point across, somehow. But using adult words doesn’t make him an adult at all – not in any sense of the word. This kid is acting in a fashion that he deems to be cool, or appropriate, to the point that even after the furore was caused from the video, his apology doesn’t necessarily sound like something he meant. The whole thing is disturbing.
Then there is the bigger problem that the video points to that no one seems to be paying attention to – the fact that bullying can push someone so far as to threaten to kill someone else in their classroom, which, I suppose, is how these American shootings happen? At the end of the video, this child says that he’s coming for his classmate, and will shoot her in the face. I know kids can be pretty horrible to each other – I’ve been a kid. I remember all too well being bullied by people larger or cooler than me, and I remember the levels of desperation I felt in trying to get away from these bullies, by any means necessary. I remember feeling like teachers wouldn’t help – and indeed, in many instances, they mocked the ‘weaker’ kids for tattling to the administration, which I can tell you for free did not encourage a whistle-blowing attitude. If I had had access to a gun or a knife – or a mobile phone to air my grievances – I can’t say that I wouldn’t have done the same thing. Being a minor is hard enough without victimisation from parents, teachers and peers – as you know if you’ve been reading the papers about the little girl who committed suicide because her teacher made fun of her period.
That’s how these suicides happen. That’s how these videos happen. A kid is pushed so close to the edge that the only way they see out is extreme measures - like these ones: using adult language to talk about things they don’t understand. Killing themselves because they genuinely don’t see a way out of the misery. They never think it is possible that high school or primary school will ever end. They think the torture and the shame is forever."